{
  "schema": 1,
  "tap_repository": "kandelo-dev/homebrew-tap-core",
  "tap_name": "kandelo-dev/tap-core",
  "tap_commit": "1111111111111111111111111111111111111111",
  "kandelo_repository": "Automattic/kandelo",
  "kandelo_commit": "2222222222222222222222222222222222222222",
  "kandelo_abi": 15,
  "release_tag": "bottles-abi-v15",
  "generated_at": "2026-06-27T00:00:00Z",
  "generator": "kandelo-homebrew-publish 1",
  "packages": [
    {
      "name": "what",
      "full_name": "kandelo-dev/tap-core/what",
      "version": "15.0.0",
      "formula_revision": 0,
      "bottle_rebuild": 0,
      "formula_path": "Formula/what.rb",
      "formula_metadata": "Kandelo/formula/what.json",
      "dependencies": [],
      "bottles": [
        {
          "arch": "wasm32",
          "bottle_tag": "wasm32_kandelo",
          "kandelo_abi": 15,
          "cellar": "/opt/kandelo/homebrew/Cellar",
          "prefix": "/opt/kandelo/homebrew",
          "url": "https://example.invalid/kandelo-homebrew/what-15.0.0-rebuild0-wasm32_kandelo.bottle.tar.gz",
          "sha256": "bbbbbbbbbbbbbbbbbbbbbbbbbbbbbbbbbbbbbbbbbbbbbbbbbbbbbbbbbbbbbbbb",
          "bytes": 12345,
          "cache_key_sha": "cccccccccccccccccccccccccccccccccccccccccccccccccccccccccccccccc",
          "link_manifest": "Kandelo/link/what-15.0.0-rebuild0-wasm32.json",
          "runtime_support": ["node"],
          "browser_compatible": false,
          "fork_instrumentation": "not-required",
          "status": "success",
          "built_by": "https://example.invalid/kandelo-dev/homebrew-tap-core/actions/runs/1",
          "built_from": {
            "kandelo_repository": "Automattic/kandelo",
            "kandelo_commit": "2222222222222222222222222222222222222222",
            "tap_repository": "kandelo-dev/homebrew-tap-core",
            "tap_commit": "1111111111111111111111111111111111111111",
            "formula_sha256": "aaaaaaaaaaaaaaaaaaaaaaaaaaaaaaaaaaaaaaaaaaaaaaaaaaaaaaaaaaaaaaaa"
          }
        }
      ]
    }
  ]
}
